itemID,Tongan Word,Dictionary Page,Number of Letters,Number of Phonemes,Number of Moras,Part of Speech,Meaning in English,Number of Participants,Reaction Time,Accuracy
2871,tau‘olunga,152,10,9,5,noun, (n) type of individual action song introduced from Samoa,29,580,0.93
2872,tāvahe,152,6,7,4,verb, (v) to move one hand up and down when speaking,24,623,1.00
2873,tāvaivaia,152,9,10,7,verb," (v) to be more or less overcome by weakness as the result of something, to be ‘knocked out’",32,486,1.00
2874,tā valivali,152,10,11,6,verb," (v) to paint (a picture), or to paint a picture of",24,604,1.00
2875,taʻahine,152,8,8,4,noun," (n) girl or young woman; maiden, virgin; virginity, maidenhood; woman of any age (if of high rank); daughter (of a chief, or of a woman of high rank)",24,537,0.96
2876,ta‘aki,152,6,6,3,verb," (v) to dig up, pull up, pull out, extract, eradicate; to unearth or bring to light or remembrance (what had been forgotten)",26,501,0.96
2877,ta‘alo,152,6,6,3,verb," (v) to wave or beckon with the hand, or with a flag or a fan",24,514,1.00
2878,taʻane,152,6,6,3,verb," (v) regal for marry, be married",29,603,1.00
2879,taʻanga,152,7,6,3,noun, (n) poem,24,559,0.96
2880,taʻataʻa,152,8,8,4,verb," (v) regal for blood, or to bleed",32,502,1.00
2881,taʻe,152,4,4,2,adverb," (adv) not, un-, in-, non-, or without",24,515,1.00
2882,taʻe fie,153,7,7,4,adverb," (adv) not desiring to, to go unwillingly, to give a forced smile",24,496,1.00
2883,taʻe hoa,153,7,7,4,adverb, (adv) without a partner or counter-part,26,591,0.96
2884,taʻeloto,153,8,8,4,adjective/verb," (adj/v) thoughtless (in regard to others), heartless, inconsiderate",23,569,0.96
2885,taʻemahino or taʻe mahino,153,10,10,5,verb, (v) to not understand,29,560,1.00
2886,taʻe motu,153,8,8,4,adverb," (adv) without intermission, without a break, uninterruptedly",24,536,1.00
2887,taʻe ngali,153,9,8,4,adjective, (adj) not suitable or befitting,32,487,0.94
2888,taʻe ngata,153,9,8,4,adverb," (adv) without termination, endless, eternal, for ever",24,578,0.92
2889,taʻe tokanga,153,11,10,5,adjective/adverb," (adj/adv) not paying attention, heedless(ly), thoughtless(ly), careless(ly), reckless(ly)",24,546,1.00
2890,taʻe tokaʻi,153,10,10,5,verb," (v) not to respect, to despise",26,505,0.96
2891,taʻe totongi,153,11,10,5,adverb," (adv) free, without paying, without payment (or being paid for)",24,544,1.00
2892,taʻe tuku,153,8,8,4,adverb," (adv) unceasingly, incessantly",29,521,0.97
2893,taʻe ʻaonga,153,10,9,5,adjective/verb," (adj/v) useless, not useful",24,573,1.00
2894,taʻo,153,4,4,2,verb," (v) to bake, (tea) to brew",31,494,1.00
2895,taʻofi,153,6,6,3,verb," (v) to hold back, restrain; to prevent, prohibit; to oppose, hinder, detain, impede, or obstruct; to stop, bring to a standstill; to hail (a passing car) in order to stop it; to withhold, refrain from giving or passing on, intercept; to put a stop to, to discontinue, to suspend; to keep, retain, reserve; to bespeak; to hold, hold up, hold in place, prevent from moving",24,479,1.00
2896,taʻokete,153,8,8,4,noun, (n) male's) older brother; (female's) older sister,24,634,1.00
2897,taʻomi,153,6,6,3,verb," (v) to press down heavily, or to press heavily upon, to crush",26,478,1.00
2898,taʻotaʻo,153,8,8,4,verb, (v) to keep (food) warm in a native oven,24,630,0.96
2899,taʻovala,153,8,8,4,noun, (n) piece of matting worn round the waist over one's tupenu,29,475,0.93
2900,taʻu,153,4,4,2,noun," (n) yam season, yam crop or harvest",24,567,1.00
2901,te,153,2,2,1,tense marker, sign of the future tense,23,593,0.87
2902,tea,153,3,3,2,adjective/verb," (adj/v) white or whitish, light in colour, pale",24,666,0.96
2903,teau,153,4,4,3,noun, (n) hundred (100); (of thatch- pieces) hundred pairs,26,624,0.88
2904,tefito,153,6,6,3,noun," (n) foot or base (of a tree, plant, post, or tooth, etc.); base or center, principal or most essential part;",24,547,0.88
2905,tefito‘i,153,8,8,4,noun," (n) base of; fundamental, principal, essential, cardinal",29,583,0.90
2906,tefua,153,5,5,3,noun, (n) ten score (200) of coconuts,23,536,0.96
2907,tefuhi,153,6,6,3,noun, (n) ten score (200) or yams,32,581,0.97
2908,teitei,153,6,6,4,adverb, (adv) very nearly; (after a neg.) at all,26,582,0.85
2909,teka,153,4,4,2,verb," (v) to roll, rotate, revolve, turn over and over; (of the wind) to veer round; (in cricket) to bowl; (in tennis) to serve",24,705,0.79
2910,tekau,153,5,5,3,noun," (n) a score, twenty (20) or coconuts",29,471,0.97
2911,teka‘i,153,6,6,3,verb," (v) to roll (a ball, etc.); (in cricket) to bowl, (in tennis) to serve",24,558,0.96
2912,teke,153,4,4,2,verb," (v) to push; to push out, to open; to push away; to resist, repel, or reject",32,540,0.97
2913,tekefili,154,8,8,4,verb," (v) to lie out in the open, to be exposed or not covered in any way",24,601,0.96
2914,tekefua,154,7,7,4,verb," (v) to be clean shaven on top (said of a person or his head); (of land) to be quite bare (as the result of a hurricane, etc.); (of a boat) to be stript of its masts and rigging",24,556,1.00
2915,tekelili,154,8,8,4,verb," (v) to shiver, tremble, quiver (with cold or rage)",26,724,0.96
2916,tekenaki,154,8,8,4,verb," (v) to lean on the hands, to support oneself partly on the hands while sitting on the floor",24,691,0.96
2917,teketeke,154,8,8,4,verb, (v) to push little by little; to push oneself in little by little,29,527,1.00
2918,teke‘i,154,6,6,3,verb, (v) to push or eject a person from the office or position that he holds,24,534,0.96
2919,tekisī,154,6,7,4,noun, (n) taxi,32,549,0.97
2920,tele,154,4,4,2,noun, (n) to peel or pare (or pare off) with a knife; to plane or shave (wood); to carve; to shave (whiskers),24,484,0.96
2921,telefoni,154,8,8,4,noun, (n) telephone,24,576,1.00
2922,telefua or tēlefua,154,7,7,4,verb," (v) to be naked, to go about naked",26,571,0.92
2923,telekalafi,154,10,10,5,noun, (n) telegraph; telegram,24,558,0.96
2924,telekava,154,8,8,4,verb, (v) to shave,29,525,1.00
2925,televīsone,154,10,11,6,noun, (n) television,24,599,0.92
2926,tele‘a,154,6,6,3,noun," (n) valley, gully, dale",32,587,1.00
2927,tele‘anga,154,9,8,4,noun, (n) place where something has been planed or pared; or place where planning is done,24,574,0.75
2928,telia,154,5,5,3,adverb," (adv) for the sake of, our of respect or consideration for",24,577,0.88
2929,telinga,154,7,6,3,noun, (n) ear,26,593,0.96
2930,telio,154,5,5,3,verb, (v) to bury (a king or queen),29,519,0.97
2931,temata,154,6,6,3,noun, (n) tomato,24,569,0.88
2932,temipale,154,8,8,4,noun, (n) temple,32,599,0.94
2933,temokalati,154,10,10,5,noun, (n) democracy,24,530,0.88
2934,te ne,154,4,4,2,pronoun," (pron) he (or she, or it) will",24,501,0.92
2935,tenisi,154,6,6,3,noun/verb, (n/v) (to play) tennis,26,522,1.00
2936,tēniti,154,6,7,4,noun, (n) tent,24,593,0.96
2937,tēnoa,154,5,6,4,adjective/noun, (adj/n) tenor,29,671,0.86
2938,tenga,154,5,4,2,noun," (n) seed, pip, grain",24,580,1.00
2939,tengetenga,154,10,8,4,adjective/verb, (adj/v) lumpy,32,656,0.91
2940,tepi,154,4,4,2,noun, (n) tape; measuring tape,24,509,0.96
2941,tēpile,154,6,7,4,noun, (n) table; schedule,26,533,0.96
2942,tēpū,154,4,6,4,adjective/noun," (adj/n) most important, most valuable, best",24,640,0.96
2943,tesi,154,4,4,2,verb, (v) to test,29,592,0.76
2944,tesimale,154,8,8,4,adjective/noun, (adj/n) decimal,24,661,0.83
2945,te te,154,4,4,2,numeral, (num) one (or I) will (or shall),32,561,0.97
2946,tete,154,4,4,2,verb," (v) to tremble, shiver, quiver, or vibrate; (of the teeth) to chatter",24,438,1.00
2947,tētē,154,4,6,4,verb, (v) to be floating,24,591,1.00
2948,teteki,154,6,6,3,verb, (v) to shudder with fright; to feel scared or embarrassed; (of a horse) to shy; to hesitate because of fear,26,558,0.96
2949,tetenga,154,7,6,3,verb, (v) to feel painful as the result of a squeeze (or as if squeezed),24,524,0.96
2950,teteʻe,154,6,6,3,verb," (v) to stick out, hang out, protrude, or to ooze out",29,599,0.90
2951,te u,154,3,3,2,adverb," (adv) I shall, I will",24,634,0.92
2952,teu,154,3,3,2,verb," (v) to prepare, get ready; to be ready or prepared; to be about to",30,540,0.97
2953,teuaki,154,6,6,4,verb," (v) to be preparing, to be in a state of preparation, or to be ready or about to occur (all referring to events not people)",23,516,1.00
2954,teunga,154,6,5,3,noun," (n) decoration, ornament- (ation); garments, apparel, attire, or uniform",24,732,0.92
2955,teuteu,155,6,6,4,verb," (v) to make preparations, to get ready",26,637,1.00
2956,teu‘i,155,5,5,3,verb, (v) to prepare or get ready (by decoration or otherwise),24,535,1.00
2957,tēvolo,155,6,7,4,noun," (n) devil, demon",29,483,1.00
2958,te‘e,155,4,4,2,noun," (n) dung, excrement (always connected with source: ‘te‘e moa' - chicken dung, etc.)",23,494,0.96
2959,teʻeki,155,6,6,3,expression, (exp) not yet,32,536,1.00
2960,teʻelango,155,9,8,4,noun, (n) freckle; beeswax; candle; fly-dirt,24,464,0.92
2961,teʻenifo,155,8,8,4,noun, (n) gums,24,532,0.96
2962,teʻepilo,155,8,8,4,verb," (v) to break wind through the back passage, pass gas",26,497,1.00
2963,teʻetuli,155,8,8,4,noun, (n) wax in the ear,24,517,1.00
2964,tī,155,2,3,2,noun, (n) tea,29,639,0.83
2965,tikatele,155,8,8,4,noun," (n) tea-kettle, kettle",24,581,0.96
2966,tikili,155,6,6,3,noun," (n) degree on a thermometer, protractor, etc.",32,646,0.97
2967,tikisinale,155,10,10,5,noun, (n) dictionary,24,717,0.88
2968,tikitato,155,8,8,4,noun, (n) dictator,24,549,0.88
2969,tikite,155,6,6,3,noun, (n) ticket,26,576,1.00
2970,timi,155,4,4,2,noun, (n) team,24,572,0.96
2971,tini,155,4,4,2,noun, (n) tin (metal); tin basin,29,641,0.97
2972,tipeiti,155,7,7,4,noun, (n) debate,24,713,0.96
2973,tipiloma,155,8,8,4,noun, (n) diploma,24,621,1.00
2974,tipōsiti,155,8,9,5,noun, (n) deposit (in a bank),24,502,1.00
2975,tisaipale,155,9,9,5,noun, (n) disciple,24,495,0.96
2976,Tisema,155,6,6,3,noun, (n) December,29,617,0.90
2977,tisi,155,4,4,2,noun, (n) dish,24,651,0.92
2978,tiusi,155,5,5,3,noun, (n) deuce (in tennis),24,683,0.75
2979,tiuta,155,5,5,3,noun," (n) tutor, college teacher",24,747,0.75
2980,to or tō,155,2,2,1,noun," (n) (in music) doh, keynote, tonic",26,534,1.00
2981,tō,155,2,3,2,noun, (n) sugar-cane,24,608,1.00
2982,toa,155,3,3,2,noun, (n) kind of tree with very hard wood (casuarina or ‘ironwood’),29,586,1.00
2983,toafa,155,5,5,3,noun," (n) uncultivated land on which there are no trees or bushes; desert, wilderness; tidal flat, area uncovered at low tide",24,617,0.88
2984,toe,155,3,3,2,adjective/adverb," (adj/adv) other, additional, else, again; even or still (with comparatives)",24,592,0.83
2985,toenga,155,6,5,3,noun," (n) remainder, left over,",24,514,0.88
2986,toe si‘i,155,7,7,4,verb, (v) to remain or be left to a small extent,26,627,0.96
2987,toe tuʻu,155,7,7,4,verb," (v) to stand again, or standing again; used also, in religious terms, for the resurrection (of Christ or of the dead)",24,533,1.00
2988,tōfā,155,4,6,4,verb," (v) regal for mohe, to sleep",29,557,0.97
2989,tōfā‘anga,155,9,11,6,noun," (n) regal for mohenga, bed for king",24,606,1.00
2990,tofi,155,4,4,2,verb," (v) to cut, cut up, or cut off, with a pressing movement",31,568,0.97
2991,tofi‘a,155,6,6,3,noun," (n) inheritance, heritage, patrimony",24,640,0.88
2992,tofu,155,4,4,2,adjective/verb," (adj/v) (of the sea) calm, smooth, clear; (of the wind, air) quite still",24,552,0.96
2993,tofua‘a,155,7,7,4,noun, (n) whale (or whale’s flesh),26,666,0.73
2994,tofuhia,155,7,7,4,verb, (v) to be becalmed,24,721,0.92
2995,tofunanga,155,9,8,4,noun, (n) fireplace (in a house),29,516,0.97
2996,tohi,155,4,4,2,noun, (n) shell or piece of shell used to split a leaf,24,593,1.00
2997,tohi ako,156,7,7,4,noun, (n) school book(s),32,552,0.84
2998,tohi fakahinohino,156,16,16,8,noun, (n) guide-book; or index book,24,513,1.00
2999,tohi fakamālō,156,12,14,8,noun, (n) letter of thanks,24,603,1.00
3000,tohi fakamatala,156,14,14,7,noun, (n) written or printed report or explanation,26,543,0.96
3001,tohi fakamoʻoni,156,14,14,7,noun, (n) certificate,24,662,1.00
3002,tohi fakamoʻua,156,13,13,7,noun, (n) credit account book; (storekeeper’s) record of credit purchases,29,618,0.97
3003,tohi fakangofua,156,14,13,7,noun, (n) written permit,24,666,0.88
3004,tohi fakaongoongolelei,156,21,19,11,noun," (n) certificate of character, written reference or recommendation, testimonial",32,470,0.97
3005,tohi fakatātā,156,12,14,8,noun, (n) picture book,23,550,1.00
3006,tohi fāʻeleʻi,156,12,13,7,noun, (n) birth certificate,24,507,1.00
3007,tohi fika,156,8,8,4,noun, (n) arithmetic book,26,536,0.96
3008,tohi folau,156,9,9,5,noun, (n) passport (see pāsipoti); clearance certificate (for a boat),24,506,1.00
3009,tohi himi,156,8,8,4,noun," (n) hymn-book, hymnal",29,637,0.93
3010,tohi hohoko,156,10,10,5,noun, (n) genealogical tree or table,24,675,1.00
3011,tohi kai,156,7,7,4,noun, (n) score book; scorer,32,497,1.00
3012,tohi kakai,156,9,9,5,noun," (n) census, statistics (of population, etc.)",24,562,0.96
3013,tohi kole,156,8,8,4,noun, (n) written application or request; begging letter,24,525,1.00
3014,tohi laukonga,156,12,11,6,noun, (n) reading book,26,570,1.00
3015,tohi lēsisita,156,12,13,7,noun," (n) register, register book, registered letter",24,704,1.00
3016,tohi māhina,156,10,11,6,noun," (n) calendar, almanac",29,570,0.86
3017,tohi mape,156,8,8,4,noun, (n) atlas,24,606,1.00
3018,tohi meili,156,9,9,5,noun, (n) letter sent by post,32,494,1.00
3019,tohi moʻua,156,9,9,5,noun," (n) account book; book in which one keeps accounts; bill, account, statement of indebtedness",23,566,1.00
3020,tohinima,156,8,8,4,noun, (n) handwriting,24,648,0.96
3021,tohinimakākā,156,12,14,8,noun/verb, (n/v) (to practice) forgery,26,535,1.00
3022,tohi noa,156,7,7,4,noun, (n) journal or diary,24,745,0.96
3023,tohi ngaohi-kai,156,13,12,7,noun, (n) cook-book,29,526,1.00
3024,tohi pangikē,156,11,11,6,noun, (n) bank book (or account),24,578,1.00
3025,tohi tali-totongi,156,15,14,7,noun, (n) receipt,32,574,1.00
3026,tohi ui,156,6,6,4,noun, (n) roll-book,24,523,0.96
3027,toho,156,4,4,2,adjective," (adj) very, very large (so large it has to be dragged): refers to pigs, turtles, mats, work and other things, but not everything)",24,693,1.00
3028,tohotoho,156,8,8,4,noun," (n) rape, crime of force against a woman or girl",26,549,1.00
3029,tohotohoʻi,156,10,10,5,verb," (v) o rape, ravish, commit rape on",24,552,1.00
3030,tohoʻanga,156,9,8,4,noun," (n) place where dragging is done, boat-slip, or dock",29,600,0.93
3031,toi,156,3,3,2,verb," (v) to hide, to conceal oneself, or to take shelter",24,530,1.00
3032,toka,156,4,4,2,verb, (v) (of chiefs) to sleep,32,579,0.91
3033,tokaange,156,8,7,4,expression," (exp) there is (or was, or will be), no doubt, but who or what we do not know",24,531,1.00
3034,tokakovi,157,8,8,4,verb, (v) to feel like vomiting,24,667,0.96
3035,tokalalo,157,8,8,4,verb," (v) submit, defer, yield, give way to or give in to",26,692,0.88
3036,tokalelei,157,9,9,5,noun," (n) flat or level place, plain",24,496,1.00
3037,tokamālie,157,9,10,6,adjective/verb," (adj/v) (of a road) in good condition; (in general) laid out properly, all set out in order; smoothed out, settled",29,628,0.93
3038,tokamui,157,7,7,4,adjective/verb, (adj/v) late (speaking of a crop),24,589,0.96
3039,tokamu‘a,157,8,8,4,adjective/verb," (adj/v) (of a crop) early; (of work, etc.) to be done beforehand",32,556,0.94
3040,tokanga,157,7,6,3,verb," (v) to take notice, pay attention; to notice, pay attention to, heed; to give attention to, tend, look after, or supervise; to be careful about, treat with care",24,475,1.00
3041,tōkanga,157,7,7,4,noun, (n) plantation,24,494,1.00
3042,tokangaʻi,157,9,8,4,verb," (v) to take notice of; to notice, to observe; to attend to, give attention to, take care of, or look after, to take care to",26,638,0.96
3043,tokāteline,157,10,11,6,noun," (n) doctrine, dogma",24,508,1.00
3044,tokaʻi,157,6,6,3,verb," (v) to have or show respect for, to consider the feelings, judgement or opinions of, to have or show consideration for; to take notice of (so as to be affected by), to mind, to object to or worry about; to care",29,672,0.90
3045,toke,157,4,4,2,noun, (n) sea eel,24,638,1.00
3046,tō kehe,157,6,7,4,verb," (v) to fall away or aside, to fall in a different direction",29,524,0.79
3047,tokelau,157,7,7,4,adjective/noun, (adj/n) north,24,638,0.96
3048,tokelau-hahake,157,13,13,7,adjective/noun, (adj/n) north-east,24,583,1.00
3049,tokelau-hihifo,157,13,13,7,adjective/noun, (adj/n) north-west,26,478,1.00
3050,toketu,157,6,6,3,verb, (v) to walk with a limp,29,526,0.93
3051,toki,157,4,4,2,adverb," (adv) just, just now (no sooner), recently; then, after that (no sooner); later on, afterwards, finally, or at last; or not until, not unless",24,571,1.00
3052,tō ki lalo,157,8,9,5,verb, (v) to fall down to a lower position,32,517,0.94
3053,tō ki tu‘a,157,8,9,5,verb," (v) to fall out (from inside a building or a car); (of a football, etc.) to go out of bounds; to be excessive (fanatical)",24,600,1.00
3054,toko,157,4,4,2,quantifier, (quantifier) word used before numerals when persons or living animals are referred to,23,498,1.00
3055,tokolahi,157,8,8,4,noun," (n) population, number (of persons, etc.); crowd; majority",26,595,1.00
3056,tokomohū,157,8,9,5,noun/verb, (n/v) (to have) hiccups,24,462,1.00
3057,tokonaki,157,8,8,4,noun, (n) food (uncooked) laid up in store or taken as provisions,29,496,1.00
3058,Tokonaki,157,8,8,4,noun, (n) Saturday,24,526,1.00
3059,tokoni,157,6,6,3,verb," (v) to help, assist, give a hand; to contribute; to give an exhortation, a talk of a moral or religious nature",32,569,1.00
3060,tokoni‘i,157,8,8,4,verb," (v) to help, assist, support",24,490,0.92
3061,tokosi‘i,157,8,8,4,adjective/verb," (adj/v) few (persons or animals); having only a few persons living or taking part in it (a house, village, voyage, etc.)",24,494,0.96
3062,toko taha,158,8,8,4,noun, (n) one (person),26,487,1.00
3063,tokoto,158,6,6,3,verb," (v) to lie (down) of persons and animals, and also of things which normally stand up",24,611,1.00
3064,tokotoko,158,8,8,4,noun, (n) walking-stick,29,555,1.00
3065,tokotokoto,158,10,10,5,verb, (v) to be lying down,24,732,0.96
3066,tokotu‘u,158,8,8,4,noun, (n) fence post or stake; stud (of the wall of a house),32,537,0.94
3067,toko ua,158,6,6,4,quantifier, (quantifier) two (of persons or living animals),24,482,0.96
3068,tokoua,158,6,6,4,noun, (n) brother or sister (without regard to sex or age on either side),24,594,0.96
3069,tokua,158,5,5,3,expression," (exp) they say, it is said, so they say, reputedly, it seems",26,554,0.92
3070,tola,158,4,4,2,noun, (n) dollar,24,537,1.00
3071,toli,158,4,4,2,verb," (v) to pick or pluck or break off (fruit, flowers, leaves); to chip, chisel, break off a piece; to till the soil round the hole in which a yam is planted; (of the sea) to eat away, encroach on, the land",29,633,1.00
3072,tōlili,158,6,7,4,verb," (v) to fly into a rage, to have a tantrum",24,579,0.79
3073,tolo,158,4,4,2,verb," (v) to throw, to throw something at; to jettison, throw overboard",32,557,0.88
3074,toloa,158,5,5,3,noun, (n) drawer; chest of drawers,24,656,0.88
3075,toloaki,158,7,7,4,verb, (v) to have chicks (of hen and duck),24,687,0.71
3076,toloi,158,5,5,3,verb," (v) to put off, postpone, defer, or adjourn; to lengthen out, draw out, extend",26,591,0.96
3077,tolonga,158,7,6,3,verb," (v) to last, endure, remain in god condition, be permanent; (of persons) to be well-preserved, to remain young-looking in spite of increasing age",24,515,1.00
3078,tolongi,158,7,6,3,verb, (v) to throw something at,28,566,0.86
3079,toloto,158,6,6,3,verb," (v) (of fish) to be entrapped (in a fish-fence, or a net); (of persons) to be surrounded or beset (by difficulties, etc.)",24,639,1.00
3080,tolotolo,158,8,8,4,verb, (v) to creep slowly or little by little,32,584,0.94
3081,tolounua,158,8,8,5,verb, (v) to have a splinter in,24,598,0.96
3082,tolu,158,4,4,2,numeral, (num) three (3),26,759,0.92
3083,tolungakau,158,10,9,5,numeral," (num) three score or sixty (60), coconuts or yams",24,652,0.96
3084,tolungeau,158,9,8,5,numeral, (num) three hundred (300); three hundred pairs; three hundred score,29,554,0.93
3085,tolungofulu,158,11,10,5,numeral, (num)thirty (30),24,518,1.00
3086,tō maka,158,6,7,4,verb," (v) to lay a foundation-stone, or to have a foundation-stone laying ceremony",32,557,1.00
3087,tome‘e,158,6,6,3,verb," (v) to be jubilant, to dance or jump about for joy",24,615,1.00
3088,tomo,158,4,4,2,verb, (v) to project; to be longer or taller or bigger than others,24,553,1.00
3089,tō-mo-hopo,158,8,9,5,verb," (v) to bob (or jog, or jerk, or bump, etc.) up and down",26,526,0.96
3090,tōmui,158,5,6,4,verb," (v) to be or happen late, or too late, or later, late",24,516,1.00
3091,tomu‘a,158,6,6,3,adverb," (adv) first, for the first time, beforehand, before something (or someone) else",29,513,1.00
3092,tōmu‘a,158,6,7,4,verb, (v) to be or happen first (before something else) or early or earlier than,24,615,0.96
3093,toni,158,4,4,2,noun, (n) ton,32,550,1.00
3094,tōnoa,158,5,6,4,verb," (v) to be, or be said or done without reason or result, or in vain or unrequited",24,558,0.92
3095,tonu,158,4,4,2,verb," (v) to be exact, correct, right, as it ought to be, or exactly suited to the occasion",24,590,0.92
3096,tonuhia,158,7,7,4,verb," (v) to be innocent, not guilty",26,650,1.00
3097,tōnunga,158,7,7,4,adjective/verb," (adj/v) faithful, conscientious",24,494,1.00
3098,Tonga,158,5,4,2,noun, (n) Tonga,29,519,0.97
3099,tonga,158,5,4,2,adjective/noun, (adj/n) south,24,543,0.96
3100,tonga-hahake,158,11,10,5,adjective/noun, (adj/n) south-east,32,577,0.97
3101,tonga-hihifo,159,11,10,5,adjective/noun, (adj/n) south-west,24,502,0.92
3102,Tongatapu,159,9,8,4,noun, (n) the largest island of Tonga,24,515,0.96
3103,tongi or tongitongi,159,5,4,2,verb," (v) to engrave or carve, or to cut notches, groves or serrations or scallops in (wood or cloth, etc.)",26,634,0.96
3104,tongiaki,159,8,7,4,noun, (n) canoe with a large outrigger,24,701,0.75
3105,tongo,159,5,4,2,noun, (n) mangrove,29,513,1.00
3106,tōpai,159,5,6,4,noun," (n) dumpling, doughboy",24,560,0.83
3107,topono,159,6,6,3,verb, (v) to feel satisfied or contented,32,694,0.97
3108,topu,159,4,4,2,noun, (n) tub,23,636,0.96
3109,topuva‘e,159,8,8,4,noun, (n) footprint; hoof; shoe,24,530,0.83
3110,tōseni,159,6,7,4,noun, (n) dozen,26,660,0.81
3111,tosi,159,4,4,2,verb, (v) to peck or nibble,24,681,1.00
3112,tositosi‘i,159,10,10,5,verb, (v) to peck or nibble at again and again,29,530,1.00
3113,tosi‘i,159,6,6,3,noun, (n) to peck or nibble at,24,736,1.00
3114,tōtakutaku,159,10,11,6,verb, (v) (of the wind) to blow in gusts; (of the day) to be gusty,32,509,0.97
3115,tō tau,159,5,6,4,verb," (v) to fall in battle, to die fighting",24,538,1.00
3116,tō-ta‘u,159,6,7,4,noun, (n) yam planting,24,551,1.00
3117,toti,159,4,4,2,verb, (v) to dot,26,493,1.00
3118,toto,159,4,4,2,noun, (n) blood,24,653,0.96
3119,totoe,159,5,5,3,noun, (n) things or pieces or scraps left over,24,614,1.00
3120,tōtōfā,159,6,9,6,verb, (v) to lie buried (of a king or queen),32,534,0.97
3121,totofi,159,6,6,3,verb, (v) to cut roughly or forcibly,24,576,0.96
3122,totoho,159,6,6,3,verb," (v) to drag hard or roughly; to drag badly (in singing, speaking, working, etc.)",24,663,0.96
3123,totoka,159,6,6,3,adjective/verb," (adj/v) to be in settled condition; (of jelly, etc.) to be set, congealed; (of the sea) calm, still, or almost still; (of persons) slow, calm, unhurried, not hasty, slow to anger",26,529,1.00
3124,totolo,159,6,6,3,verb," (v) to creep or crawl on all fours; to grovel or crawl to a person; to go or come stealthily, or in such a way as to escape notice; (of plants) to creep, trail, or climb; to spread or extend gradually",24,506,0.96
3125,totonu,159,6,6,3,adjective/verb," (adj/v) straight; right, correct, befitting, proper, normal, rightful, as it ought to be",29,601,1.00
3126,totongi,159,7,6,3,verb," (v) to pay or pay for (money, goods, workmen, debt, etc.)",24,578,1.00
3127,totongi-huhu‘i,159,13,12,6,verb, (v) to pay compensation for,32,550,1.00
3128,totongi-malu‘i,159,13,12,6,verb, (v) to pay a deposit on; or to bail out (a prisoner),24,633,1.00
3129,totongi-mamafa,159,13,12,6,adjective/verb," (adj/v) high-priced, expensive",24,560,1.00
3130,totongi-ma‘ama‘a,159,15,14,7,adjective/verb," (adj/v) low-priced, cheap",26,524,0.96
3131,totongi-‘osi,159,11,10,5,verb, (v) to pay or pay for in full,24,639,0.83
3132,totosi,159,6,6,3,verb," (v) to nibble, nibble at, take very small bites (of)",29,585,1.00
3133,totototo,159,8,8,4,adjective/verb," (adj/v) blood-coloured, ruddy, red; (of the eyes) bloodshot",24,573,1.00
3134,toto-vai,159,7,7,4,noun," (n) anaemia, thinness of blood",31,486,0.97
3135,toto‘e,159,6,6,3,verb, (v) to mumble in a moaning kind of way,24,669,0.83
3136,tou,159,3,3,2,noun, (n) dough or uncooked pastry,23,692,1.00
3137,toulalanga,159,10,9,5,verb, (v) to work for one another in turns in weaving,26,588,0.88
3138,toume,159,5,5,3,noun, (n) coconut spathe (often used for kindling fires),29,594,0.97
3139,toumohomoho,160,11,11,6,noun, (n) leaves which have been used for covering food in a native oven,24,613,0.96
3140,toumoloto,160,9,9,5,verb, (v) to be at half-mast,32,512,1.00
3141,toumu‘a,160,7,7,4,noun," (n) front or nearer side of a plantation; frontage (of one’s property), strip of ground between the front fence (or edge) and the public road",24,504,0.96
3142,toungāue,160,8,8,6,verb," (v) (of a number of people) to work for one another in turns all working for one of the group one day, for another on another day, and so on",24,650,0.71
3143,tousi,160,5,5,3,noun, (n) toast,26,526,0.88
