itemID,Tongan Word,Dictionary Page,Number of Letters,Number of Phonemes,Number of Moras,Part of Speech,Meaning in English,Number of Participants,Reaction Time,Accuracy
1042,fufula,104,6,6,3,verb," (v) to swell, swell up, swell out; to pout, or to blow out the cheeks",24,523,1.00
1043,fufulu,104,6,6,3,verb," (v) to wash or scrub, to clean",26,527,0.92
1044,fufuu‘i,104,7,7,4,verb, (v) to hide or conceal,24,511,1.00
1045,fuhi,104,4,4,2,noun, (n) bunch,29,574,0.97
1046,fuhinga,104,7,6,3,noun, (n) bunch,24,620,0.79
1047,fuhu,104,4,4,2,verb," (v) to fight with the fists, to box; to engage in a free fight",32,517,1.00
1048,fuka,104,4,4,2,noun," (n) banner, flag",24,571,0.92
1049,fukahi,104,6,6,3,noun, (n) surface,24,593,0.96
1050,fuke,104,4,4,2,verb, (v) to open up a native oven,26,527,0.92
1051,fukefuke,104,8,8,4,verb, (v) to unwrap (a parcel),24,628,0.92
1052,fulihi,104,6,6,3,adverb, (adv) inverted or upside-down,29,562,0.97
1053,fulū,104,4,5,3,noun, (n) influenza,24,592,0.96
1054,fulufulu,104,8,8,4,noun, (n) hair; fur; feather,32,555,1.00
1055,fulufulu‘i manu,104,14,14,7,noun, (n) feathers,24,519,1.00
1056,fulufulu‘i sipi,104,14,14,7,noun, (n) wool,24,562,1.00
1057,fulufulua,104,9,9,5,adjective/verb," (adj/v) hairy, furry, woolly, or feathery",26,595,1.00
1058,fulutāmakia,104,11,12,7,verb," (v) to be suffocated, to be suffocating or unable to breathe",24,652,1.00
1059,funga,104,5,4,2,noun," (n) top, upper surface",24,612,0.96
1060,funga matapā,104,11,11,6,noun, (n) lintel,31,664,1.00
1061,funga matapā-sio‘ata,104,18,18,10,noun," (n) window- sill, or top (lintel) of window",23,623,1.00
1062,fungani,104,7,6,3,adjective/verb," (adj/v) tip-top, first rate, excellent, especially or extremely good",24,559,0.71
1063,fu'ifu'i,105,8,8,4,verb," (v) to throw or pour or sprinkle water on, or to douse",26,510,1.00
1064,fuo,105,3,3,2,noun, (n) shape,24,555,1.00
1065,fuofua,105,6,6,4,noun, (n) pimple,29,536,1.00
1066,fuolahi,105,7,7,4,adjective/verb," (adj/v) (of circle or square) wide, large in diameter; (of stick or cylinder) thick; (of ball) big, large",24,620,0.96
1067,fuolalahi,105,9,9,5,adjective/verb," (adj/v) dual or plural of preceding; large-grained, coarse (sand or sugar)",32,498,0.97
1068,fuoloa,105,6,6,4,adjective/verb," (adj/v) long (in duration); long ago; old, ancient",24,584,0.88
1069,fuoloa si'i,105,10,10,6,adverb/verb," (adv/v) (to be or continue) for a while, or for a time (but not for long)",24,544,0.96
1070,fuolōloa,105,8,9,6,adjective/verb," (adj/v) long-shaped, long in proportion to its breadth; oval, elliptical",26,563,1.00
1071,fuopotopoto,105,11,11,6,adjective/verb," (adj/v) round, circular, cylindrical, spherical",24,608,1.00
1072,fuosi'i,105,7,7,4,adjective/verb," (adj/v) (of circle or square) narrow, small in diameter; (of stick or cylinder) thin; (of ball) small, little",29,535,0.97
1073,fuo-tatau,105,8,8,5,adjective/verb, (adj/v) of the same shape,24,588,0.96
1074,fusi,105,4,4,2,noun, (n) plantain or banana (of any kind),32,499,0.97
1075,fusi taula,105,9,9,5,verb," (v) to pull up the anchor, to weigh anchor",24,656,0.92
1076,fute,105,4,4,2,adjective," (adj) habitually restless, continually jumping about",24,752,0.92
1077,fu'u,105,4,4,2,adjective," (adj) big, large, great or numerous",26,536,1.00
1078,ha,105,2,2,1,article," (art) a, an, some, any (sometimes untranslatable)",24,698,0.83
1079,hā,105,2,3,2,interrogative, (interrog) what,29,538,0.97
1080,hae,105,3,3,2,verb," (v) to tear, rend; to tear apart, pull apart; to tear off, strip off; to open by tearing or forcibly; to break into (a house)",24,648,0.83
1081,hafu,105,4,4,2,noun, (n) small waterfall,24,584,0.92
1082,haha,105,4,4,2,verb," (v) to hit, beat, thrash, or thresh; to knock down fruit with a stick",24,649,0.83
1083,hāhā,105,4,6,4,verb, (v) to appear or come into view slightly or gradually or continually,26,459,1.00
1084,hahake,105,6,6,3,adjective," (adj) east, eastern",24,676,0.96
1085,hāhāmolofia,105,11,13,8,adjective/verb," (adj/v) scarce or rare, seen or met with only occasionally",29,563,1.00
1086,hahau,105,5,5,3,noun, (n) dew night moisture,23,625,0.91
1087,haisini,105,7,7,4,noun, (n) hygiene,24,711,0.79
1088,haka,105,4,4,2,noun, (n) food put on to boil or stew; boiled or stewed food,24,470,1.00
1089,haka mao,106,7,7,4,verb, (v) to steam (cook in steam),26,564,0.96
1090,hakalo,106,6,6,3,noun, (n) coconut- scraper,24,635,1.00
1091,hakau,106,5,5,3,noun, (n) coral reef or rock which appears above the surface at low tide,29,520,0.93
1092,hake,106,4,4,2,adverb," (adv) up, upwards, along, past",24,569,0.88
1093,hakevela,106,8,8,4,noun/verb, (n/v) (to have) heart-burn,32,734,0.81
1094,hako,106,4,4,2,verb," (v) to grow long, to lengthen out in growing",24,499,0.92
1095,hakolo,106,6,6,3,verb, (v) to make a noise like that of something boiling,26,710,0.88
1096,haku,106,4,4,2,noun, (n) young sword-fish,24,593,0.96
1097,hakulā,106,6,7,4,noun, (n) sword-fish,29,488,0.97
1098,hakule,106,6,6,3,verb," (v) to rummage about, to ransack; to examine carefully",24,704,0.92
1099,hala,106,4,4,2,noun," (n) path, road; stairway",32,492,0.97
1100,hala ‘atā,106,8,9,5,verb, (v) not to have any at all,24,527,1.00
1101,hala loto ‘api,106,12,12,6,verb," (v) to walk through, or trespass on somebody's property",24,547,1.00
1102,hala-fakakavakava,106,16,16,8,noun, (n) bridge,26,639,1.00
1103,halaia,106,6,6,4,verb, (v) to be guilty,24,837,0.92
1104,halanga,106,7,6,3,noun," (n) track, trail",28,605,0.93
1105,halani,106,6,6,3,verb, (v) (of the sun or moon) to give light above the horizon shortly before it rises,24,526,0.79
1106,halelu‘ia,106,9,9,5,interjection, (interj) hallelujah,32,626,0.97
1107,halu,106,4,4,2,verb," (v) to slit, to shred, to cut or tear into fine strips; tear up, scarify (the soil)",24,581,0.92
1108,hāmala,106,6,7,4,noun, (n) hammer,24,533,0.96
1109,hami,106,4,4,2,noun, (n) ham,26,669,0.73
1110,hamu,106,4,4,2,adverb, (adv) to give a sudden sharp pain,24,559,1.00
1111,hana,106,4,4,2,pronoun, (pron) their (dual),29,621,0.93
1112,hanga,106,5,4,2,verb, (v) to turn (so as to face in a specified direction); to look or see; (of a word) to refer,32,544,0.91
1113,hanganoa,106,8,7,4,verb," (v) to attend to by way of distraction, to divert one’s mind (from worry, sorrow)",24,651,0.79
1114,hangatonu,106,9,8,4,adjective/adverb/verb," (adj/adv/v) straight, straight along, directly; in a straight line; level, on a level; to go straight, to face directly, or concern directly",24,530,0.96
1115,hangē,106,5,5,3,verb," (v) to be like, to resemble, or to be according to or in conformity with; to be as if, to seem that",26,534,0.96
1116,hano,106,4,4,2,pronoun," (pron) his, her, its",24,720,0.79
1117,hanu,106,4,4,2,verb," (v) to complain, to express dissatisfaction",29,623,1.00
1118,ha'o,106,4,4,2,pronoun, (pron) your (singular),24,564,0.75
1119,haohaoa,106,7,7,5,adverb, (adv) perfectly; absolutely good; thoroughly,32,528,0.75
1120,ha‘a,107,4,4,2,noun," (n) people, race, tribe; person having the rank or status of; descendants of (kings, nobles)",24,518,1.00
1121,ha‘aki,107,6,6,3,verb," (v) to throw down with violence; to put down with force, to plank down; to bang or slam (a door)",23,569,1.00
1122,ha‘alo,107,6,6,3,verb," (v) to make clean and smooth by scraping tutu (inner bark or mulberry tree, used in making tapa cloth)",26,489,1.00
1123,ha‘ama,107,6,6,3,pronoun, (pron) our (dual),23,481,1.00
1124,ha‘amo,107,6,6,3,pronoun, (pron) your (dual),28,537,1.00
1125,Ha‘amonga,107,9,8,4,noun, (n) the famous prehistoric triathlon between Kolonga and Niutoua (on Tongatapu),24,622,1.00
1126,ha‘amoutolu,107,11,11,6,pronoun," (pron) your, yours (plural)",32,527,1.00
1127,ha‘ana,107,6,6,3,pronoun, (pron) their (dual),24,549,1.00
1128,ha‘anaua,107,8,8,5,pronoun," (pron) their, theirs (dual)",24,533,0.92
1129,ha‘anautolu,107,11,11,6,pronoun, (pron) theirs (plural),26,580,0.96
1130,ha‘ane,107,6,6,3,pronoun," (pron) his, her, its",24,669,1.00
1131,ha‘amoua,107,8,8,5,pronoun," (pron) your, yours (dual)",29,628,0.93
1132,haʻaku,107,6,6,3,pronoun, (pron) my,23,540,0.96
1133,haʻamau,107,7,7,4,pronoun, (pron) our (plural),32,613,0.91
1134,haʻamo,107,6,6,3,verb, (v) to carry on a stick over the shoulder,24,486,0.96
1135,Haʻamoa,107,7,7,4,noun, (n) Samoa,24,542,1.00
1136,haʻamonga,107,9,8,4,noun, (n) load or burden carried on a shoulder-stick,26,516,1.00
1137,haʻamou,107,7,7,4,pronoun, (pron) your (plural),24,620,1.00
1138,Haʻapai,107,7,7,4,noun, (n) the central group of the three main island groups of Tonga,29,535,1.00
1139,haʻape,107,6,6,3,noun, (n) harp,24,597,1.00
1140,haʻata,107,6,6,3,noun, (n) our (dual),32,539,1.00
1141,haʻataua,107,8,8,5,pronoun," (pron) our, ours (dual)",24,603,1.00
1142,haʻatautolu,107,11,11,6,pronoun, (pron) ours (plural),23,519,0.96
1143,haʻate,107,6,6,3,pronoun," (pron) one’s, my",26,461,1.00
1144,haʻau,107,5,5,3,pronoun," (pron) your, yours (singular)",24,515,1.00
1145,hāʻele,107,6,7,4,verb, (v) to go (regal for ʻalu); to come (regal for haʻu),29,497,1.00
1146,haʻi,107,4,4,2,noun," (n) binding; bond, that which binds, or fetters; bracket or parenthesis",24,459,0.96
1147,haʻinga,107,7,6,3,noun," (n) bundle, bunch (of things tied together)",32,521,1.00
1148,hapai,107,5,5,3,verb, (v) to support or carry on the palms of the hands,24,646,0.92
1149,hapohapo,107,8,8,4,verb," (v) to keep on throwing something up and catching it, or to play at throwing and catching",24,640,0.96
1150,hata,107,4,4,2,pronoun, (pron) our (dual),29,611,0.93
1151,hau,107,3,3,2,noun," (n) ear-ring, ear ornament; nose- ring, nose ornament",24,573,0.83
1152,haua,107,4,4,3,adjective/verb, (adj/v) continually wandering about as if more or less insane,24,572,0.83
1153,hauhau,107,6,6,4,adjective/verb," (adj/v) damp, moist",26,554,0.96
1154,hauhausia,107,9,9,6,verb," (v) to be soft, or mildewed, through exposure to damp air",24,698,0.71
1155,have‘i,107,6,6,3,verb," (v) to break in pieces, to smash; to crush, mangle, or squash",29,539,0.90
1156,havehave,107,8,8,4,verb," (v) to come to pieces, to be or become shattered, broken, smashed or crushed",24,673,0.88
1157,havili,107,6,6,3,noun," (n) wind, strong breeze; draft",32,500,0.91
1158,havilivili,107,10,10,5,verb, (v) to be breezy,24,526,1.00
1159,ha‘o,108,4,4,2,pronoun, (pron) your (singular),24,481,1.00
1160,haofanga,108,8,7,4,noun, (n) ring or circle of people,26,644,0.85
1161,haʻu,108,4,4,2,verb," (v) to come; begin to come, come away",24,594,1.00
1162,hē,108,2,3,2,verb," (v) to stray, go astray; to err",23,541,1.00
1163,he‘ete or ‘ete,108,6,6,3,pronoun," (pron) one’s, my",32,480,0.97
1164,heʻe,108,4,4,2,interjection, (interj) here you are!,24,457,1.00
1165,heʻeku or ʻeku,108,6,6,3,pronoun, (pron) my,24,511,0.96
1166,heʻema or ʻema,108,6,6,3,pronoun, (pron) our (dual),25,509,0.96
1167,heʻemau or ʻemau,108,7,7,4,pronoun, (pron) our (plural),24,540,1.00
1168,heʻena,108,6,6,3,pronoun, (pron) their (dual),29,552,0.97
1169,heʻenau or ʻenau,108,7,7,4,pronoun, (pron) their (plural),24,576,0.96
1170,heʻene or ʻene,108,6,6,3,pronoun," (pron) his, her, its",32,589,0.97
1171,heʻeta or ʻeta,108,6,6,3,pronoun, (pron) our (dual),24,500,1.00
1172,heʻetau or ʻetau,108,7,7,4,pronoun, (pron) our (plural),24,600,0.96
1173,hēhē‘ia,108,7,9,6,verb, (v) to talk in one’s sleep,26,540,1.00
1174,heheke,108,6,6,3,adjective/verb, (adj/v) very smooth and slippery,24,689,1.00
1175,hehengi,108,7,6,3,adjective/verb," (adj/v) wild, undomesticated -",29,662,0.76
1176,heilala,108,7,7,4,noun, (n) flowering tree,24,580,0.96
1177,heka,108,4,4,2,verb," (v) to sit on anything raised above the ground, to sit on a chair; to mount or go aboard, to ride in or on",32,566,1.00
1178,hekasi,108,6,6,3,verb," (v) to crush or damage (or run the risk of doing so) by sitting or riding on; to ride for the first time, break in",24,783,0.88
1179,heke,108,4,4,2,adjective/verb," (adj/v) lame, crippled, not able to walk at all",24,581,0.83
1180,hekea,108,5,5,3,verb," (v) to slip, slide (accidentally)",26,573,0.81
1181,hekeheke,108,8,8,4,adjective/verb, (adj/v) slippery,24,552,1.00
1182,hēkesi,108,6,7,4,noun, (n) neck-tie,28,550,1.00
1183,hela,108,4,4,2,noun, (n) tiredness; asthma,24,577,1.00
1184,hela‘ia,108,7,7,4,verb," (v) to be tired out, to feel exhausted",32,508,0.97
1185,hele,108,4,4,2,verb, (v) to cut with a knife,24,531,0.92
1186,hele‘uhila,108,10,10,5,noun," (n) lantern pictures; moving pictures; magic lantern, projector |",24,510,1.00
1187,heletā,108,6,7,4,noun, (n) sword,26,528,0.96
1188,heli,108,4,4,2,noun, (n) hell,23,703,0.91
1189,helikopetā,108,10,11,6,noun, (n) helicopter,29,641,1.00
1190,helu,108,4,4,2,noun, (n) comb,24,642,0.92
1191,hema,108,4,4,2,adjective/verb, (adj/v) left side; left-handed person,32,554,0.75
1192,hena,108,4,4,2,adverb/pronoun," (adv/pron) that, those; that place, or there, where you are or are looking",24,672,0.88
1193,hengihengi,108,10,8,4,noun, (n) early morning,26,581,0.77
1194,heni,108,4,4,2,adverb/pronoun," (adv/pron) this, these; this place; here",24,585,0.96
1195,Hepelū,108,6,7,4,adjective/noun, (adj/n) Hebrew,29,534,1.00
1196,Hētesi,108,6,7,4,noun, (n) Hades,24,506,1.00
1197,hētolo,108,6,7,4,noun, (n) hurdle; hurdle race,31,515,0.97
1198,heu,108,3,3,2,verb," (v) to rake; to stir or poke; to stir or mix by stirring; to shuffle; to push out of the way, to shove away, or to ward off; to clean, clean out, remove dirt",24,589,0.71
1199,hēvani,108,6,7,4,noun, (n) heaven,24,527,0.96
1200,hia,109,3,3,2,noun," (n) offence, crime, wrong-doing",26,521,0.92
1201,hifi,109,4,4,2,verb," (v) to cut, cut up, carve, pare, or slice; to cut up and string (beans); to trim the edges of (wood)",24,514,1.00
1202,hifo,109,4,4,2,verb," (v) to go down, descend; to dismount, get down, get out (of a vehicle), alight; to get off, go ashore, disembark; to go down to the beach or into the water; to be deposed or dismissed from office",32,497,0.94
1203,hifo‘anga,109,9,8,4,noun," (n) place for going down or descending; place where a road, etc., slopes down; or cause or reason for going down",24,518,1.00
1204,hihi,109,4,4,2,verb," (v) to scoop out, gouge out; (of clams) to open with a knife and detach the flesh hihifo: (adj) west, western",24,577,0.96
1205,hihifo,109,6,6,3,noun," (n) west, direction in which the sun sets",26,534,0.92
1206,hihiloku,109,8,8,4,verb, (v) to gouge out the flesh of a green coconut,24,715,0.79
1207,hika,109,4,4,2,adjective/verb, (adj/v) (of the hair) straight,29,586,1.00
1208,hiki,109,4,4,2,verb," (v) to lift, raise; to move from one place or position to another, to transfer; to copy; to quote; to translate",23,523,1.00
1209,hiki-ha‘aki,109,10,10,5,verb, (v) to lift up and throw down with violence,32,497,0.97
1210,hikinima,109,8,8,4,verb, (v) to raise one’s hand in voting,24,678,0.92
1211,hikinima‘i,109,10,10,5,verb," (v) to vote for, or vote on by raising the hand",24,564,1.00
1212,hiko,109,4,4,2,noun/verb, (n/v) to juggle(or juggling),26,563,0.96
1213,hiku,109,4,4,2,noun, (n) tail (of fish or reptile); end (of a rope or string); tip (of a leaf); lower end,24,556,1.00
1214,hikumata,109,8,8,4,noun, (n) outer corner of the eye,29,687,0.76
1215,hila,109,4,4,2,verb," (v) to glance, to turn the eyes",24,607,0.96
1216,hili,109,4,4,2,verb, (v) to put or lay or place on something,32,485,0.97
1217,hili‘anga,109,9,8,4,noun," (n) place or thing on which things are laid, shelf",24,534,0.96
1218,hilifaki,109,8,8,4,verb, (v) to put or lay on place on top of something,23,505,1.00
1219,hilifaki-kalauni,109,15,15,8,noun, (n) coronation,26,613,1.00
1220,hilifakinima,109,12,12,6,verb, (v) to confirm or ordain,24,683,0.88
1221,himi,109,4,4,2,noun, (n) hymn,28,480,1.00
1222,hina,109,4,4,2,noun, (n) spider,24,758,1.00
1223,hinā,109,4,5,3,adjective/verb, (adj/v) grey or white (of the hair),32,478,1.00
1224,hinehina,109,8,8,4,adjective/verb, (adj/v) white,24,539,0.96
1225,hingoa,109,6,5,3,noun, (n) name,23,590,0.96
1226,hisitōlia,109,9,10,6,noun, (n) history,24,532,1.00
1227,hiva,109,4,4,2,verb, (v) to sing,29,582,0.93
1228,hiva kakala,109,10,10,5,noun, (n) love song,23,646,1.00
1229,hiva ngūngū,109,10,10,6,verb, (v) to hum,32,495,1.00
1230,hivaʻi,109,6,6,3,verb, (v) to sing or to proclaim in song,24,519,1.00
1231,hivangofulu,109,11,10,5,numeral, (num) ninety (90),26,617,1.00
1232,ho,109,2,2,1,pronoun, (pron) your (singular),24,701,0.75
1233,hoa,109,3,3,2,noun," (n) mate, partner, counterpart; spouse; pair",29,516,0.97
1234,hoha‘a,110,6,6,3,verb," (v) to worry, to be anxious or uneasy or troubled in mind; to make a fuss",24,476,1.00
1235,hoha‘a‘ia,110,9,9,5,verb, (v) to be worried,32,586,0.91
1236,hōhō,110,4,6,4,verb," (v) to breathe hard with the mouth open, to pant",24,480,1.00
1237,hohoko,110,6,6,3,verb," (v) to be consecutive or successive, to be or occur or continue in unbroken succession",24,565,1.00
1238,hōifua,110,6,7,5,verb, (v) to feel fresh and comfortable,26,583,1.00
1239,hoihoifua,110,9,9,6,adjective/verb, (adj/v) beautiful and well- proportioned,24,610,0.92
1240,hoka,110,4,4,2,verb," (v) to ram; jab, poke, or strike with the tip of a rod; to stab; to harpoon (whales); to husk (coconuts)",29,616,1.00
1241,hoka‘anga niu,110,12,11,6,noun, (n) place where coconuts are husked,24,777,1.00
1242,hoko,110,4,4,2,noun," (n) joint, junction; continuation",32,531,0.94
1243,hoku,110,4,4,2,pronoun, (pron) my,24,496,1.00
1244,hola,110,4,4,2,noun, (n) fleeing; or a stowaway,24,606,0.96
1245,Holani,110,6,6,3,noun, (n) Holland,26,564,0.96
1246,hole,110,4,4,2,verb, (v) to wear or carry something thrown over the shoulder,24,625,0.79
1247,holi,110,4,4,2,verb," (v) to want, desire, crave, wish for, lust or long for",29,489,0.97
1248,holisi,110,6,6,3,noun, (n) wall (of a building),24,497,1.00
1249,holo,110,4,4,2,noun," (n) hall, passage",32,540,0.97
1250,holo‘i,110,6,6,3,verb, (v) to wipe up or wipe off,24,551,1.00
1251,holoholo,110,8,8,4,noun, (n) handkerchief,26,518,1.00
1252,holoholo‘anga,110,13,12,6,noun," (n) door mat, mat for wiping one’s feet on",24,569,1.00
1253,holoki,110,6,6,3,verb," (v) to pull down, demolish",29,510,0.97
1254,holomui,110,7,7,4,verb," (v) to go backwards, to retrogress; (of an army) to fall back, retreat, retire, or withdraw",23,702,0.96
1255,homau,110,5,5,3,pronoun, (pron) ours (plural),32,648,0.91
1256,homo,110,4,4,2,pronoun, (pron) your (dual),24,562,0.96
1257,homohomo,110,8,8,4,verb," (v) to be loose, inclined to slip out",23,573,1.00
1258,homou,110,5,5,3,pronoun, (pron) your (more than two persons),26,568,0.85
1259,hona,110,4,4,2,pronoun, (pron) their (two persons),24,567,0.96
1260,honau,110,5,5,3,pronoun," (pron) their, theirs (more than two persons)",29,604,0.79
1261,hongofulu,110,9,8,4,numeral, (num) ten (10),24,517,1.00
1262,hono,110,4,4,2,pronoun," (pron) his, her, its",24,502,0.96
1263,hoʻatā,111,6,7,4,noun," (n) noon, midday, middle of the day",26,472,0.92
1264,hoʻo,111,4,4,2,pronoun, (pron) your (singular),24,595,1.00
1265,hoʻoku,111,6,6,3,pronoun," (pron) my, mine",29,525,1.00
1266,hoʻomaua,111,8,8,5,pronoun," (pron) our, ours (dual)",24,562,1.00
1267,hoʻomautolu,111,11,11,6,pronoun," (pron) our, ours (plural)",32,503,1.00
1268,hoʻomo,111,6,6,3,pronoun, (pron) your (dual),24,544,1.00
1269,hoʻomou,111,7,7,4,pronoun, (pron) your (plural),24,576,1.00
1270,hoʻomoua,111,8,8,5,pronoun," (pron) your, yours (dual)",26,530,0.96
1271,hoʻona,111,6,6,3,pronoun," (pron) his, her, its",24,564,0.96
1272,hoʻonaua,111,8,8,5,pronoun," (pron) their, theirs (dual)",29,558,1.00
1273,hoʻonautolu,111,11,11,6,pronoun," (pron) their, theirs (plural)",24,578,0.92
1274,hoosi,111,5,5,3,noun," (n) horse, mare",32,511,0.94
1275,hoʻota,111,6,6,3,pronoun," (pron) one's, my, mine",24,548,1.00
1276,hoʻotaua,111,8,8,5,pronoun," (pron) our, ours (dual)",26,635,1.00
1277,hoʻotautolu,111,11,11,6,pronoun," (pron) our, ours (plural)",24,531,1.00
1278,hoʻou,111,5,5,3,pronoun," (pron) your, yours (singular)",29,542,0.86
1279,hopa,111,4,4,2,noun," (n) plantain with firm yellow flesh, short, thick, blunt-ended",24,582,0.96
1280,hopo,111,4,4,2,verb," (v) to go to court, litigate",24,489,1.00
1281,hopoʻanga laʻā,111,13,13,7,noun," (n) place where the sun rises, east",24,584,0.96
1282,hopoate,111,7,7,4,noun, (n) slave; person captured in war and made into a slave,26,635,0.85
1283,hopohopo,111,8,8,4,verb, (v) to keep on jumping or skipping,24,623,1.00
1284,hopoki,111,6,6,3,verb," (v) to go on board (a boat) as the first person to do so, and so to declare it ready for service",29,593,0.90
1285,hosana,111,6,6,3,interjection, (interj) hosanna,24,628,0.88
1286,hota,111,4,4,2,pronoun, (pron) our (dual),32,549,0.91
1287,hotau,111,5,5,3,pronoun, (pron) our (plural),24,619,0.75
1288,hoto,111,4,4,2,pronoun," (pron) one's, my",24,523,0.92
1289,hou,111,3,3,2,verb," (v) (of the sea) to be agitated, rough - referring to water and wind at the same time; (of ones mind) to be agitated, upset, troubled, in turmoil; of one’s stomach, to be upset, qualmish, nauseated",26,667,0.81
1290,houa,111,4,4,3,noun, (n) hour,24,615,1.00
1291,houʻeiki,111,8,8,5,noun, (n) chiefs,29,477,1.00
1292,houhau,111,6,6,4,verb, (v) regal for angry,24,755,1.00
1293,hounga,111,6,5,3,verb," (v) to be a cause of gratitude to, to be appreciated by",32,582,0.91
1294,hū,111,2,3,2,verb," (v) to enter, to go in; to pass through an entrance",24,487,0.88
1295,hua,111,3,3,2,verb," (v) (of pigs) to root in the earth, to turn over the earth with the snout",24,590,0.92
1296,hua‘i,111,5,5,3,verb," (v) to pour out, empty out, throw out or away, spill",26,512,0.92
1297,huafa,111,5,5,3,noun, (n) name (of king or queen),24,592,1.00
1298,huelo,111,5,5,3,verb," (v) ray, beam or shaft (of light)",23,682,0.83
1299,hūfaki,111,6,7,4,verb, (v) to intercede for (in prayer),31,519,1.00
1300,hūfanga,111,7,7,4,noun, (n) refuge,24,572,0.88
1301,hūfia,111,5,6,4,verb," (v) to make intercession or supplication for, to pray for",24,463,0.92
1302,huhu,111,4,4,2,noun, (n) breast; udder,26,519,1.00
1303,huhua,111,5,5,3,verb, (v) to pour out roughly or forcibly or without care,24,614,0.92
1304,huhulu,111,6,6,3,verb," (v) to be luminous, to shine or be radiant (of a lamp, the moon etc.) ",29,553,0.97
1305,hū mai,112,5,6,4,verb, (v) to come in or out (this way),24,493,0.96
1306,hu‘a,112,4,4,2,noun, (n) the incoming tide,32,421,0.97
1307,hu‘akau,112,7,7,4,noun, (n) cow’s milk; milk,24,514,1.00
1308,hū‘anga,112,7,7,4,noun," (n) entrance, place of entry",24,521,0.96
1309,hu‘u,112,4,4,2,verb," (v) to have one’s head to or towards; or to head for (350) interesting, to like",25,507,1.00
1310,huhu toto,112,8,8,4,verb, (v) to give or receive blood transfusion,24,599,1.00
1311,huhuʻa,112,6,6,3,noun," (n) juice, or any juice-like ligiid",29,506,1.00
1312,huhuʻi,112,6,6,3,verb, (v) to prick,24,479,1.00
1313,huhunu,112,6,6,3,noun/verb, (n/v) chicken pox,32,549,0.94
1314,hui,112,3,3,2,adjective, (adj) (of a fish) bony,24,539,0.92
1315,hui-lalanga,112,10,9,5,noun," (n) knitting needle, crochet needle; or darning needle",24,809,1.00
1316,hui-palalulu,112,11,11,6,noun, (n) ribs,26,557,0.96
1317,hui-tuʻa,112,7,7,4,noun, (n) backbone,24,565,1.00
1318,hui-tuitui,112,9,9,6,noun, (n) sewing needle,29,584,1.00
1319,huka,112,4,4,2,noun, (n) hook,24,638,0.92
1320,hukaʻi,112,6,6,3,verb, (v) to hook,32,626,1.00
1321,huke,112,4,4,2,verb," (v) to lift the edge of (a mat, sheet, etc.); to draw back, turn back, fold back (curtain or screen); to hold up, tuck up, turn up, or roll up (dress or sleeve); to open (a book), to turn to (a page); to rummage about in (a box or its contents)",24,702,1.00
1322,hulohula,112,8,8,4,noun," (n) dance, ball",24,593,0.96
1323,hulu,112,4,4,2,verb," (v) to show a light, or to give light",26,549,1.00
1324,hulu‘i,112,6,6,3,verb," (v) to flash, to give light with; or to throw light on",24,497,1.00
1325,humu,112,4,4,2,verb, (v) to stumble and fall,29,558,0.93
1326,hunuki,112,6,6,3,noun," (n) stake, peg, in the ground",24,554,1.00
1327,huo,112,3,3,2,verb," (v) to hoe, to clear of grass or weeds (with a spade or hoe)",32,568,0.72
1328,huo-kauvao,112,9,9,6,noun, (n) sharpened stick used for husking coconuts or for digging,24,642,0.92
1329,husepāniti,112,10,11,6,noun, (n) husband,24,627,0.92
1330,huufi,112,5,5,3,verb, (v) to officially open (a building),26,563,0.92
1331,ī,112,1,2,2,noun, (n) fan,24,527,0.88
1332,ia,112,2,2,2,pronoun," (pron) him, he, her, she, it or (of inanimate objects) them, they",29,552,0.86
1333,ifi,112,3,3,2,verb," (v) to blow with the mouth; to blow or blow into or play (a whistle or wind instrument); to blow up, inflate",31,560,0.97
1334,ifi pula,112,7,7,4,noun, (n) to blow bubbles,24,539,0.96
1335,ifo,112,3,3,2,adjective/verb, (adj/v) tasty; interesting,24,545,1.00
1336,ifo‘ia,112,6,6,4,noun, (n) to find tasty or pleasant or,26,523,1.00
1337,ihu,112,3,3,2,noun, (n) nose; trunk (elephant's),24,719,0.83
1338,ihu-pe‘e,112,7,7,4,noun, (n) mucus in the nose or running from the nose,29,522,1.00
1339,iiki,112,4,4,3,adjective/verb," (adj/v) small, sometimes it means younger (dual & plural of si‘i)",24,554,0.96
1340,ika,112,3,3,2,noun, (n) fish,31,534,0.97
1341,iku,112,3,3,2,verb," (v) to end, terminate, culminate; issue, result, finish up",24,504,0.92
1342,ikuna,112,5,5,3,noun, (n) victory,24,789,0.96
1343,iku‘anga,112,8,7,4,noun," (n) end, ending, what it leads to, culmination, issue, final result or outcome",26,521,1.00
1344,ilifia,113,6,6,4,verb," (v) to be afraid, to feel frightened",24,523,0.96
1345,inu,113,3,3,2,noun, (n) drinking,29,674,0.83
1346,ipu,113,3,3,2,noun," (n) cup, drinking glass",24,774,0.71
